선호관광,사이트제목,성별,연령,직업,소득,결혼,자녀,주거,시도,구,동,자동차
곽지,제주여행 곽지해변에서 한담공원 멋진뷰,F,4,"주부 (전업주부, 파트타임 근무 주부)",400~499만원,예    ,자녀 있음 ,아파트/ 주상복합,경기,평택시,가재동,"준중형차 (아반떼, K3, 크루즈, 제타급 등)"
농월정,함양 남계서원 농월정 일두고택,F,4,"주부 (전업주부, 파트타임 근무 주부)",400~499만원,예    ,자녀 있음 ,아파트/ 주상복합,경기,평택시,가재동,"준중형차 (아반떼, K3, 크루즈, 제타급 등)"
청도온천,청도 온천갑니다용,M,4,"관리직 (사장, 간부, 고위공무원)",700~799만원,예    ,자녀 있음 ,아파트/ 주상복합,서울,강동구,둔촌1동,"중형차 (쏘나타, K5, 말리부, 골프급 등)"
울릉도,2025년부터 울릉도에 비행기 타고 간다 | jobsN : 네이버 포스트,M,4,기타 ,300~399만원,예    ,자녀 없음 ,단독주택,경남,함안군,가야읍,"대형차 (제너시스, BMW5급 등)"
오어사,포항가볼만한곳 운제산 오어사 : 네이버 블로그,M,4,"기능직 (자동차정비, 운전기사, 안경사, 택시기사)",300~399만원,아니오,          ,단독주택,경기,평택시,비전2동,"중형차 (쏘나타, K5, 말리부, 골프급 등)"
제주중문,제주중문숙소 롯데호텔화산쇼 후기~ : 네이버 블로그,F,4,"교직 (교사, 유치원교사, 학원강사)",600~699만원,예    ,자녀 있음 ,아파트/ 주상복합,광주,북구,문흥동,"중형차 (쏘나타, K5, 말리부, 골프급 등)"
원주플라워프루트월드,원주 플라워프루트월드 관광단지 조성 사업 본격화,F,4,"교직 (교사, 유치원교사, 학원강사)",600~699만원,예    ,자녀 있음 ,아파트/ 주상복합,광주,북구,문흥동,"중형차 (쏘나타, K5, 말리부, 골프급 등)"
영국사,충북 영동 가볼만한곳 천태산 영국사,M,3,"사무직 (일반사무직, 공무원, 직업군인)",300~399만원,예    ,자녀 있음 ,아파트/ 주상복합,경기,용인시 처인구,김량장동,"경차 (모닝, 스파크 등)"
혜국사,문경 주흘산 등산코스 제1관문여궁폭포혜국사주봉 원점회귀 산행,F,4,"주부 (전업주부, 파트타임 근무 주부)",400~499만원,예    ,자녀 있음 ,아파트/ 주상복합,서울,마포구,대흥동,
안성죽산,2019 안성 죽산 문화재 야행 이야기,M,4,,,      ,          ,,서울,중랑구,면목본동,
고흥우주해양,김 지사 고흥 우주항공 중심도시로 대도약,F,4,"주부 (전업주부, 파트타임 근무 주부)",200~299만원,예    ,자녀 있음 ,연립주택/ 다세대/ 빌라,서울,양천구,목3동,
신화역사공원,제주 신화역사공원 홍차 카페 다만프레르,M,5,무직,700~799만원,예    ,자녀 있음 ,아파트/ 주상복합,서울,송파구,신천동,
호미곶,포항펜션 두남자와 함께했던 코지스위트펜션 죽도시장호미곶,F,5,"교직 (교사, 유치원교사, 학원강사)",100~199만원,예    ,자녀 있음 ,아파트/ 주상복합,경기,의왕시,오전동,"중형차 (쏘나타, K5, 말리부, 골프급 등)"
해운대,해운대 사진 찍다 테트라포드 사이 추락 40대 자력 탈출 | 연합뉴스,M,2,"사무직 (일반사무직, 공무원, 직업군인)",300~399만원,아니오,          ,단독주택,부산,서구,서대신동3가,
도곡온천,화순 중봉산도곡온천 기준으로 완벽한 원점회귀 산행코스,F,5,"주부 (전업주부, 파트타임 근무 주부)",100~199만원,예    ,자녀 없음 ,아파트/ 주상복합,부산,사상구,주례3동,"준대형차 (그랜저, K7, 알페온, 캠리급, 파사트급 등)"
송불암,논산여행 황산벌의 중심에 자리한 논산 송불암 미륵불,M,3,"서비스직 (요식업, 숙박업, 미용실종업원)",100~199만원,아니오,          ,단독주택,서울,중구,신당동,
해인사,해인사 템플스테이 : 네이버,F,3,"주부 (전업주부, 파트타임 근무 주부)",700~799만원,예    ,자녀 있음 ,아파트/ 주상복합,경기,수원시 영통구,원천동,"준중형차 (아반떼, K3, 크루즈, 제타급 등)"
무창포해수욕장,보령 대천해수욕장과 무창포 해변,M,3,"사무직 (일반사무직, 공무원, 직업군인)",500~599만원,예    ,자녀 없음 ,아파트/ 주상복합,서울,중구,신당동,"중형SUV (싼타페, 쏘렌토, 캡티바, BMW X3급 등)"
일락사,일락사개심사서산농장용현계곡퉁퉁고개,F,3,"사무직 (일반사무직, 공무원, 직업군인)",400~499만원,예    ,자녀 없음 ,아파트/ 주상복합,경남,창원시 성산구,남양동,
문수사,고창 청량산 문수사,F,4,"주부 (전업주부, 파트타임 근무 주부)",600~699만원,예    ,자녀 있음 ,아파트/ 주상복합,경기,의왕시,포일동,"경차 (모닝, 스파크 등)"
내장산리조트,정읍시 내장산리조트 최대규모 민자유치,F,4,"자영업 (도소매업, 숙박업, 미용업)",400~499만원,예    ,자녀 있음 ,아파트/ 주상복합,인천,남동구,구월3동,"준중형SUV (투싼, 스포티지, QM5, 티구안급 등)"
영월온천,201707387001 영월군 영월읍 심옥리 영월온천,M,4,,,      ,          ,,대구,달서구,상인1동,
금강하구둑,금강자전거길신탄진금강하구둑20190702,M,2,"생산/노무직 (생산감독, 경비원, 공장근로자)",600~699만원,아니오,          ,아파트/ 주상복합,경기,오산시,금암동,"MPV (카니발, 올란도, 피카소급, 오딧세이 등)"
약천사,제주도가볼만한곳으로 약천사를 추천합니다 여기가 가장큰절인가요? : 네이버 블로그,F,4,기타 ,300~399만원,예    ,자녀 있음 ,아파트/ 주상복합,서울,마포구,신수동,
홍길동테마파크,장성 홍길동 테마파크 반가운 지인들과의 카라반 캠핑,F,2,"사무직 (일반사무직, 공무원, 직업군인)",900~999만원,아니오,          ,아파트/ 주상복합,서울,은평구,녹번동,
울릉도,울릉도 일주도로 개통 묵호항 강릉항 출발 : 네이버 블로그,M,4,"서비스직 (요식업, 숙박업, 미용실종업원)",200~299만원,예    ,자녀 없음 ,아파트/ 주상복합,전남,화순군,화순읍,"경차 (모닝, 스파크 등)"
홍천비발디파크,비발디파크 근처 펜션 홍천 힐링하우스 뜨끈한 온돌방 넘나 좋음,F,2,"학생 (초중고학생, 대학생, 대학원생)",100만원 미만,아니오,          ,아파트/ 주상복합,서울,동대문구,답십리동,
여수첼린지파크,여수 유월드 루지 테마파크 핫플 인정 100만표,M,4,"생산/노무직 (생산감독, 경비원, 공장근로자)",200~299만원,아니오,          ,연립주택/ 다세대/ 빌라,경기,안산시 상록구,사2동,
운암사,비라칸사스와 함께한 광양 운암사,M,2,"학생 (초중고학생, 대학생, 대학원생)",100만원 미만,아니오,          ,오피스텔,서울,송파구,풍납동,"준중형차 (아반떼, K3, 크루즈, 제타급 등)"
갑사,부실경영 책임지... :: 네이버 뉴스,F,2,"학생 (초중고학생, 대학생, 대학원생)",300~399만원,아니오,          ,아파트/ 주상복합,부산,부산진구,가야2동,
대관령어흘리,대관령 어흘리 100년 소나무 숲길  대관령 치유의 숲길,M,4,"사무직 (일반사무직, 공무원, 직업군인)",300~399만원,예    ,자녀 있음 ,아파트/ 주상복합,서울,강동구,암사동,"준중형차 (아반떼, K3, 크루즈, 제타급 등)"
아리랑마을,국악의 고장 전라남도 진도  국립남도국악원 아리랑 마을,M,3,"교직 (교사, 유치원교사, 학원강사)",600~699만원,예    ,자녀 없음 ,연립주택/ 다세대/ 빌라,경기,성남시 수정구,양지동,"준대형차 (그랜저, K7, 알페온, 캠리급, 파사트급 등)"
경천대,상주 경천대마음이 열리는 이곳 경천대 국민관광지,M,4,"사무직 (일반사무직, 공무원, 직업군인)",500~599만원,예    ,자녀 있음 ,아파트/ 주상복합,서울,서초구,잠원동,"중형차 (쏘나타, K5, 말리부, 골프급 등)"
백천사,사천와룡산백천사 : 네이버 통합검색,F,5,,,      ,          ,,경기,하남시,풍산동,"중형차 (쏘나타, K5, 말리부, 골프급 등)"
연주암,최씽씽의 역사자료실 :: [관악산 코스]정부과천청사역에서 연주대 가는 법 및 연주암 기도 비용 안내,M,3,기타 ,500~599만원,아니오,          ,연립주택/ 다세대/ 빌라,부산,부산진구,부암1동,
성기동,영암 왕인박사 유적지   3 성기동 성천,M,5,"자영업 (도소매업, 숙박업, 미용업)",200~299만원,예    ,자녀 있음 ,아파트/ 주상복합,인천,부평구,삼산1동,
춘장대해수욕장,춘장대 해수욕장과 홍원항 쭈꾸미낚시 풍경,F,4,"주부 (전업주부, 파트타임 근무 주부)",500~599만원,예    ,자녀 있음 ,아파트/ 주상복합,서울,강서구,우장산동,
북고사,늦가을 무주의 북고사 성지순례,F,4,"판매직 (상점점원, 보험설계사, 노점상)",900~999만원,예    ,자녀 있음 ,아파트/ 주상복합,부산,부산진구,가야동,"준중형차 (아반떼, K3, 크루즈, 제타급 등)"
양양국제공항,양양국제공항 타고 제주도 가기 코리아익스프레스에어,M,4,"관리직 (사장, 간부, 고위공무원)",800~899만원,예    ,자녀 있음 ,단독주택,강원,강릉시,연곡면,"준대형차 (그랜저, K7, 알페온, 캠리급, 파사트급 등)"
울릉도,2박3일 울릉도여행 그 시작부터 끝까지! : 네이버 블로그,F,2,"교직 (교사, 유치원교사, 학원강사)",300~399만원,아니오,          ,아파트/ 주상복합,전남,함평군,함평읍,
표충사,영남알프스 배내고개~능동산~천황산~재약산~표충사 산행 : 네이버 블로그,M,5,무직,200~299만원,예    ,자녀 있음 ,아파트/ 주상복합,부산,북구,덕천2동,
마니산,한국명산 031 강화도 마니산 등산기,F,3,"학생 (초중고학생, 대학생, 대학원생)","1,000만원 이상",아니오,          ,아파트/ 주상복합,경기,부천시 원미구,중4동,
용연사,대구 가볼만한곳 :: 2019년 부처님오신날 대구 전통 사찰 4곳 소개 - 동화사 파계사 용연사 대견사 : 네이버 블로그,F,4,"주부 (전업주부, 파트타임 근무 주부)",100~199만원,예    ,자녀 있음 ,연립주택/ 다세대/ 빌라,서울,강동구,고덕동,
안성죽산,2019 안성 죽산 문화재 야행 이야기,F,4,"주부 (전업주부, 파트타임 근무 주부)",100~199만원,예    ,자녀 있음 ,연립주택/ 다세대/ 빌라,서울,강동구,고덕동,
화암,백제 삼천궁녀 목숨 잃은 낙화암 부소산 일대 아닌 백마강 옷바위 | 다음 뉴스,M,4,기타 ,200~299만원,아니오,          ,아파트/ 주상복합,경기,김포시,구래동,
오어사,포항 오어사 : 네이버 통합검색,F,4,"주부 (전업주부, 파트타임 근무 주부)",400~499만원,예    ,자녀 있음 ,아파트/ 주상복합,경기,파주시,조리읍,
경산온천,경산온천상대온천좋아요,M,2,"학생 (초중고학생, 대학생, 대학원생)","1,000만원 이상",아니오,          ,아파트/ 주상복합,경기,안양시 만안구,안양1동,
통도사,통도사서 모녀가 ... :: 네이버 뉴스,M,5,"사무직 (일반사무직, 공무원, 직업군인)",400~499만원,예    ,자녀 있음 ,아파트/ 주상복합,서울,노원구,월계3동,기타 (승합차/트럭/화물차/기타 차량 등)
개척사,미국 개척사에 두드러진 두 청년,F,2,"전문직 (의사, 판검사, 예술가, 종교인)",200~299만원,아니오,          ,오피스텔,경남,창원시 성산구,중앙동,
청도온천,청도 온천갑니다용,F,4,,,      ,          ,,충남,당진군,송산면,
원각사,가볍게 다이어트 트레킹 겸 다녀온 의정부 원각사,F,4,,,      ,          ,,서울,강남구,일원1동,
마우나오션,LPGA가 열렸던 마우나오션cc로 가을골프 다녀왔어요,F,4,"주부 (전업주부, 파트타임 근무 주부)",100만원 미만,예    ,자녀 있음 ,아파트/ 주상복합,울산,동구,방어동,"중형SUV (싼타페, 쏘렌토, 캡티바, BMW X3급 등)"
기장도예촌,카라반캠핑기장도예촌,F,5,,,      ,          ,,,,,
천안종합휴향,세종싸이클로드,M,5,"자영업 (도소매업, 숙박업, 미용업)",700~799만원,예    ,자녀 있음 ,아파트/ 주상복합,서울,용산구,한남동,"준중형SUV (투싼, 스포티지, QM5, 티구안급 등)"
도곡온천,화순 중봉산도곡온천 기준으로 완벽한 원점회귀 산행코스,M,3,"사무직 (일반사무직, 공무원, 직업군인)",300~399만원,예    ,자녀 없음 ,단독주택,경기,고양시 일산동구,정발산동,"준대형차 (그랜저, K7, 알페온, 캠리급, 파사트급 등)"
죽림사,영천 부처님 오신 날 / 우리나라에서 부처님이 가장 많은 만불사 철조여래좌상이 있는 죽림사 - 영천 사찰 : 네이버 블로그,F,5,기타 ,600~699만원,예    ,자녀 있음 ,아파트/ 주상복합,경기,양주시,고암동,"준중형차 (아반떼, K3, 크루즈, 제타급 등)"
청도온천,청도 온천갑니다용,M,3,"사무직 (일반사무직, 공무원, 직업군인)","1,000만원 이상",아니오,          ,오피스텔,경북,안동시,옥동,
영탑사,절로절로 우리절 20 당진 영탑사,M,3,"자영업 (도소매업, 숙박업, 미용업)",200~299만원,아니오,          ,단독주택,광주,동구,소태동,"준중형SUV (투싼, 스포티지, QM5, 티구안급 등)"
강원오색,강원 설악산 오색약수근처 오색휴펜션 오색약수 계곡 초대받아 힐링하고 왔어요,M,3,"사무직 (일반사무직, 공무원, 직업군인)",600~699만원,예    ,자녀 있음 ,아파트/ 주상복합,서울,성동구,왕십리2동,"프리미엄 (에쿠스, BMW7급 등)"
합천보조댐,경상남도 산책길  합천 가볼만한곳 산책하며 데이트하기 좋은 길 합천 보조댐 수변생태 탐방로,F,4,"교직 (교사, 유치원교사, 학원강사)",200~299만원,아니오,          ,아파트/ 주상복합,경기,안양시 동안구,부흥동,
흑석사,광주 샤브샤브 맛집 흑석사거리 푸짐한 월남쌈 : 네이버 블로그,F,5,"주부 (전업주부, 파트타임 근무 주부)",400~499만원,예    ,자녀 있음 ,아파트/ 주상복합,서울,마포구,도화동,
수승대,[경상남도 거창/ 병곡횟집] 수승대 월성계곡 계곡식당을 찾아~ : 네이버 블로그,F,3,"주부 (전업주부, 파트타임 근무 주부)",100~199만원,예    ,자녀 있음 ,아파트/ 주상복합,부산,동래구,온천동,
연주암,과천에서 관악산 연주암 가는길 - Daum 검색,M,2,"전문직 (의사, 판검사, 예술가, 종교인)",200~299만원,아니오,          ,연립주택/ 다세대/ 빌라,서울,동작구,대방동,
팔봉산,191117 홍천 팔봉산 블랙야크100대명산 산림청100대명산 한국의산하인기100산,F,4,"판매직 (상점점원, 보험설계사, 노점상)",600~699만원,예    ,자녀 있음 ,연립주택/ 다세대/ 빌라,인천,부평구,부평동,"MPV (카니발, 올란도, 피카소급, 오딧세이 등)"
울릉도,[포항出] 환상의섬 울릉도 2/3일 특가대표! 위메프 모바일,F,3,"사무직 (일반사무직, 공무원, 직업군인)",200~299만원,아니오,          ,연립주택/ 다세대/ 빌라,서울,중구,장충동2가,"중형차 (쏘나타, K5, 말리부, 골프급 등)"
쌍계사,경상남도 하동  하동 가볼만한곳 지리산자락으로 가을여행 떠나요 하동 쌍계사,F,3,"주부 (전업주부, 파트타임 근무 주부)",200~299만원,예    ,자녀 있음 ,아파트/ 주상복합,경기,수원시 권선구,금곡동,
평택호,시원한 늦봄 풍경이 펼쳐지는 평택호로 놀러오세요! : 네이버 블로그,F,2,무직,500~599만원,아니오,          ,아파트/ 주상복합,인천,남동구,구월2동,
광덕계곡,즐거운 와인딩 코스 여우고개  백운계곡  광덕계곡  도마치재 M으로 지지기,M,4,"사무직 (일반사무직, 공무원, 직업군인)",800~899만원,예    ,자녀 있음 ,아파트/ 주상복합,경기,의정부시,호원2동,"준중형차 (아반떼, K3, 크루즈, 제타급 등)"
도곡온천,화순 중봉산도곡온천 기준으로 완벽한 원점회귀 산행코스,M,4,"사무직 (일반사무직, 공무원, 직업군인)",600~699만원,예    ,자녀 있음 ,아파트/ 주상복합,서울,강남구,도곡동,"중형차 (쏘나타, K5, 말리부, 골프급 등)"
알펜시아,강원도여행 평창 알펜시아 홀리데이인스위트 투베드룸과 오션700 워터파크,F,3,"사무직 (일반사무직, 공무원, 직업군인)",900~999만원,아니오,          ,연립주택/ 다세대/ 빌라,서울,은평구,역촌동,
김녕해수욕장,제주도 바다 색이 아름다운 김녕해수욕장 물놀이,M,3,"자영업 (도소매업, 숙박업, 미용업)",300~399만원,아니오,          ,연립주택/ 다세대/ 빌라,대구,동구,신암동,"대형차 (제너시스, BMW5급 등)"
화암,백제 삼천궁녀 목숨 잃은 낙화암 부소산 일대 아닌 백마강 옷바위 | 다음 뉴스,F,3,"사무직 (일반사무직, 공무원, 직업군인)",400~499만원,예    ,자녀 있음 ,아파트/ 주상복합,전북,군산시,장재동,
청평사,춘천 단풍구경하며 산책겸 등산코스 청평사가는길,F,3,"주부 (전업주부, 파트타임 근무 주부)",400~499만원,예    ,자녀 있음 ,아파트/ 주상복합,경기,수원시 권선구,당수동,"준중형차 (아반떼, K3, 크루즈, 제타급 등)"
삽교호,당진 삽교호 한 바퀴,M,4,"전문직 (의사, 판검사, 예술가, 종교인)",300~399만원,아니오,          ,아파트/ 주상복합,전북,전주시 완산구,서신동,"중형SUV (싼타페, 쏘렌토, 캡티바, BMW X3급 등)"
일심사,오이타 여행 코스벚꽃 운해 잇신지일심사,F,3,"주부 (전업주부, 파트타임 근무 주부)",200~299만원,예    ,자녀 없음 ,아파트/ 주상복합,대전,유성구,지족동,"준중형차 (아반떼, K3, 크루즈, 제타급 등)"
죽도,경남사천죽도 : 네이버 VIEW,M,5,"사무직 (일반사무직, 공무원, 직업군인)",500~599만원,예    ,자녀 있음 ,연립주택/ 다세대/ 빌라,인천,남동구,간석3동,"중형차 (쏘나타, K5, 말리부, 골프급 등)"
혜국사,문경 주흘산 등산코스 제1관문여궁폭포혜국사주봉 원점회귀 산행,F,3,"사무직 (일반사무직, 공무원, 직업군인)",300~399만원,아니오,          ,연립주택/ 다세대/ 빌라,경기,수원시 팔달구,우만1동,
울릉도,서울~울릉도 하늘길로 1시간 만에 간다..2025년 5월 운항 | 다음 뉴스,M,4,"판매직 (상점점원, 보험설계사, 노점상)",500~599만원,예    ,자녀 있음 ,아파트/ 주상복합,서울,은평구,불광2동,"중형차 (쏘나타, K5, 말리부, 골프급 등)"
수리사,어린 양 잡아가는 흰꼬리수리 사진이 논란이 된 이유 | 다음 뉴스,F,5,"전문직 (의사, 판검사, 예술가, 종교인)",200~299만원,아니오,          ,아파트/ 주상복합,경기,용인시 수지구,상현동,
화암,강원도 고성 금강산 화암사 나들이 : 네이버 블로그,F,3,"전문직 (의사, 판검사, 예술가, 종교인)",200~299만원,아니오,          ,아파트/ 주상복합,경기,남양주시,진건읍,
송정,부산 송정 맛집 알찬 전복영양밥 한그릇,M,3,"사무직 (일반사무직, 공무원, 직업군인)",500~599만원,아니오,          ,아파트/ 주상복합,경기,남양주시,평내동,"중형차 (쏘나타, K5, 말리부, 골프급 등)"
제주남원,최고라고 말하고싶은 제주 남원 맛집,M,5,"사무직 (일반사무직, 공무원, 직업군인)",400~499만원,예    ,자녀 있음 ,아파트/ 주상복합,경남,창원시 성산구,상남동,"중형차 (쏘나타, K5, 말리부, 골프급 등)"
운주사,화순 운주사,F,2,"학생 (초중고학생, 대학생, 대학원생)",300~399만원,아니오,          ,아파트/ 주상복합,강원,춘천시,동내면,
땅끝,2018. 단풍따라 흐르는 가을여행 - 14. 토말. 땅끝마을,F,5,,,      ,          ,,울산,남구,달동,
충주호체험,충주호 유람선 체험,F,4,"사무직 (일반사무직, 공무원, 직업군인)",100~199만원,예    ,자녀 있음 ,아파트/ 주상복합,경기,수원시 영통구,영통동,
해남사,해남사 양대응 스님,M,4,"주부 (전업주부, 파트타임 근무 주부)",700~799만원,예    ,자녀 없음 ,아파트/ 주상복합,경기,용인시 처인구,고림동,"준중형SUV (투싼, 스포티지, QM5, 티구안급 등)"
지장사,방탄소년단 정국 지장사 직원분이 알려준 꾹이 비하인드스토리,F,4,"교직 (교사, 유치원교사, 학원강사)",300~399만원,예    ,자녀 있음 ,연립주택/ 다세대/ 빌라,서울,동대문구,회기동,
지리산온천,함양맛집/육지랑 바다~여기 불고기전골. 예술입니당~^^ 지리산온천랜드에서 피로풀기ㅠ : 네이버 블로그,M,2,"생산/노무직 (생산감독, 경비원, 공장근로자)",200~299만원,아니오,          ,연립주택/ 다세대/ 빌라,충남,서산시,동문동,"준중형차 (아반떼, K3, 크루즈, 제타급 등)"
제주용머리,제주 용머리해안 맛집 가족 식사엔 카도돈카츠,M,4,"생산/노무직 (생산감독, 경비원, 공장근로자)",200~299만원,아니오,          ,오피스텔,경기,이천시,관고동,
평택호,시원한 늦봄 풍경이 펼쳐지는 평택호로 놀러오세요! : 네이버 블로그,F,3,"사무직 (일반사무직, 공무원, 직업군인)",200~299만원,아니오,          ,오피스텔,서울,중랑구,상봉동,
용화사,운양동 용화사 : 네이버 카페,F,5,"서비스직 (요식업, 숙박업, 미용실종업원)",400~499만원,예    ,자녀 있음 ,아파트/ 주상복합,대전,동구,천동,"중형차 (쏘나타, K5, 말리부, 골프급 등)"
돌문화공원, 제주여행제주관광  제주 돌문화공원,M,5,,,      ,          ,,서울,관악구,은천동,
해인사,해인사 템플스테이 : 네이버,M,2,"주부 (전업주부, 파트타임 근무 주부)",100만원 미만,아니오,          ,단독주택,서울,강남구,신사동,"대형SUV (베라크루즈, 모하비, 투아렉급 등)"
간월도,서산 간월도 간월암 다녀왔어요,M,4,"사무직 (일반사무직, 공무원, 직업군인)",400~499만원,예    ,자녀 있음 ,아파트/ 주상복합,서울,노원구,월계2동,"중형차 (쏘나타, K5, 말리부, 골프급 등)"
장의사,①한장의 사진이 준 울림…계엄령 광주를 가야겠다 : 네이트뉴스,M,2,"학생 (초중고학생, 대학생, 대학원생)",200~299만원,아니오,          ,아파트/ 주상복합,광주,남구,양림동,
영주순흥,풍기 온천 후 영주 순흥 선비촌 다녀왔습니다,M,5,"사무직 (일반사무직, 공무원, 직업군인)",400~499만원,예    ,자녀 있음 ,단독주택,서울,도봉구,도봉1동,"중형차 (쏘나타, K5, 말리부, 골프급 등)"
오목내,진주 판문동 맛집 오목내 솔직후기,M,4,"사무직 (일반사무직, 공무원, 직업군인)",600~699만원,예    ,자녀 없음 ,아파트/ 주상복합,서울,관악구,신림동,"준대형차 (그랜저, K7, 알페온, 캠리급, 파사트급 등)"
전등사,전등사 : 네이버 카페,F,4,"주부 (전업주부, 파트타임 근무 주부)",500~599만원,예    ,자녀 있음 ,아파트/ 주상복합,경기,용인시 수지구,상현동,
합천호,합천 악견산~의룡산 종주 - 합천호 조망과 천길단애를 경험할 수 있는 산 (대병3산/대병5악/십자바위/악견산성),F,5,"학생 (초중고학생, 대학생, 대학원생)",400~499만원,아니오,          ,아파트/ 주상복합,경기,수원시 장안구,파장동,
거가대교,가덕도 가볼 만한 곳 연대봉 세계 최대 수심 해저터널 거가대교,F,3,"주부 (전업주부, 파트타임 근무 주부)",500~599만원,예    ,자녀 있음 ,아파트/ 주상복합,인천,연수구,송도동,"중형SUV (싼타페, 쏘렌토, 캡티바, BMW X3급 등)"
합천호,합천 악견산~의룡산 종주 - 합천호 조망과 천길단애를 경험할 수 있는 산 (대병3산/대병5악/십자바위/악견산성),M,5,"서비스직 (요식업, 숙박업, 미용실종업원)",300~399만원,예    ,자녀 있음 ,연립주택/ 다세대/ 빌라,울산,남구,삼산동,
백천사,백천사 : 네이버 플레이스,M,4,"사무직 (일반사무직, 공무원, 직업군인)",200~299만원,아니오,          ,연립주택/ 다세대/ 빌라,서울,강남구,대치동,"중형SUV (싼타페, 쏘렌토, 캡티바, BMW X3급 등)"
라비에벨,부천예식장 라비에벨웨딩 기억에 많이 남을 것 같아요,M,5,기타 ,500~599만원,아니오,          ,오피스텔,경기,수원시 영통구,이의동,"준대형차 (그랜저, K7, 알페온, 캠리급, 파사트급 등)"
삼척해수욕장,삼척여행 Part1삼척 하얀낭만펜션일미어담삼척해변,M,4,"생산/노무직 (생산감독, 경비원, 공장근로자)",500~599만원,예    ,자녀 있음 ,아파트/ 주상복합,강원,강릉시,홍제동,"중형차 (쏘나타, K5, 말리부, 골프급 등)"
백천사,백천사 : 네이버 플레이스,F,5,"자영업 (도소매업, 숙박업, 미용업)",700~799만원,예    ,자녀 있음 ,단독주택,서울,광진구,중곡1동,"준대형차 (그랜저, K7, 알페온, 캠리급, 파사트급 등)"
